{
  "document_id": "BC_011",
  "source_files": [
    "data/raw_images/DataSet/Birth Certificate/BC_011.jpeg"
  ],
  "page_count": 1,
  "birth_certificate": {
    "document_title_ar": "صورة قيد الميلاد",
    "serial_number": "2813513970",
    "registration_number": "1130",
    "registration_date": null,
    "issue_date": "2021/02/03",
    "health_office": "شبين الكوم أول",
    "civil_registry": "مركز شبين الكوم",
    "issuing_authority": "وزارة الداخلية / قطاع الأحوال المدنية",
    "governorate_or_administration": "المنوفية",
    "form_reference": null,
    "issuance_system_version": null,
    "barcode_or_machine_notes": null
  },
  "ids": {
    "child_national_id": "30804051700313",
    "father_national_id": "27111251700379",
    "mother_national_id": "27610041701026",
    "other_ids": []
  },
  "personal_and_other": {
    "child": {
      "name": "عمر",
      "gender": "ذكر",
      "religion": "مسلم",
      "nationality": "مصر",
      "place_of_birth": "المنوفية / مركز شبين الكوم",
      "date_of_birth": "05/04/2008"
    },
    "father": {
      "name": "علي فتحي مصطفى ابو عنبة الله",
      "religion": "مسلم",
      "nationality": "مصر"
    },
    "mother": {
      "name": "نجلاء شوقي عبد المجيد البيري",
      "religion": "مسلمة",
      "nationality": "مصر"
    },
    "misc_notes": null
  },
  "uncertain_fields": [
    "personal_and_other.child.name"
  ],
  "review_required": false,
  "review_notes": []
}
