{
  "document_id": "BC_035",
  "source_files": [
    "data/raw_images/DataSet/Birth Certificate/BC_035.jpeg"
  ],
  "page_count": 1,
  "birth_certificate": {
    "document_title_ar": "صورة قيد الميلاد",
    "serial_number": "3089883686",
    "registration_number": "308",
    "registration_date": "2008/08/06",
    "issue_date": "2022/06/29",
    "health_office": "البتانون",
    "civil_registry": "مركز شبين الكوم",
    "issuing_authority": "وزارة الداخلية / قطاع الأحوال المدنية",
    "governorate_or_administration": "المنوفية",
    "form_reference": null,
    "issuance_system_version": null,
    "barcode_or_machine_notes": null
  },
  "ids": {
    "child_national_id": null,
    "father_national_id": null,
    "mother_national_id": null,
    "other_ids": []
  },
  "personal_and_other": {
    "child": {
      "name": "سيف",
      "gender": "ذكر",
      "religion": "مسلم",
      "nationality": "مصر",
      "place_of_birth": "المنوفية / مركز شبين الكوم",
      "date_of_birth": "01/08/2008"
    },
    "father": {
      "name": "سامح محمد مصطفى عيسى",
      "religion": "مسلم",
      "nationality": "مصر"
    },
    "mother": {
      "name": "رشا محمد اسماعيل عمارة",
      "religion": "مسلمة",
      "nationality": "مصر"
    },
    "misc_notes": null
  },
  "uncertain_fields": [
    "ids.child_national_id"
  ],
  "review_required": false,
  "review_notes": [
    "duplicate scan of BC_025; child national id covered by diagonal stamp"
  ]
}
