{
  "document_id": "BC_004",
  "source_files": [
    "data/raw_images/DataSet/Birth Certificate/BC_004.jpeg"
  ],
  "page_count": 1,
  "birth_certificate": {
    "document_title_ar": "صورة قيد الميلاد",
    "serial_number": "2698722617",
    "registration_number": "267",
    "registration_date": "2005/05/10",
    "issue_date": "2020/08/16",
    "health_office": "البتانون",
    "civil_registry": "مركز شبين الكوم",
    "issuing_authority": "وزارة الداخلية / قطاع الأحوال المدنية",
    "governorate_or_administration": "المنوفية",
    "form_reference": null,
    "issuance_system_version": null,
    "barcode_or_machine_notes": null
  },
  "ids": {
    "child_national_id": "30505091700067",
    "father_national_id": null,
    "mother_national_id": null,
    "other_ids": []
  },
  "personal_and_other": {
    "child": {
      "name": "روينا",
      "gender": "أنثى",
      "religion": "مسلمة",
      "nationality": "مصر",
      "place_of_birth": "المنوفية / مركز شبين الكوم",
      "date_of_birth": "09/05/2005"
    },
    "father": {
      "name": "ابراهيم عبد الغني حسن بدر",
      "religion": "مسلم",
      "nationality": "مصر"
    },
    "mother": {
      "name": "غادة حسني الحضري",
      "religion": "مسلمة",
      "nationality": "مصر"
    },
    "misc_notes": null
  },
  "uncertain_fields": [
    "ids.child_national_id",
    "personal_and_other.child.name"
  ],
  "review_required": true,
  "review_notes": [
    "diagonal stamp overlay; child name and national IDs not clearly legible"
  ]
}
