{
  "document_id": "BC_016",
  "source_files": [
    "data/raw_images/DataSet/Birth Certificate/BC_016.jpeg"
  ],
  "page_count": 1,
  "birth_certificate": {
    "document_title_ar": "صورة قيد الميلاد",
    "serial_number": "0361869400",
    "registration_number": "1053",
    "registration_date": "2003/09/21",
    "issue_date": "2007/06/24",
    "health_office": "شبين الكوم ثان",
    "civil_registry": "شبين الكوم",
    "issuing_authority": "وزارة الداخلية / قطاع الأحوال المدنية",
    "governorate_or_administration": "المنوفية",
    "form_reference": null,
    "issuance_system_version": null,
    "barcode_or_machine_notes": null
  },
  "ids": {
    "child_national_id": "30309151703602",
    "father_national_id": null,
    "mother_national_id": null,
    "other_ids": []
  },
  "personal_and_other": {
    "child": {
      "name": "اسراء",
      "gender": "أنثى",
      "religion": "مسلمة",
      "nationality": "مصر",
      "place_of_birth": "المنوفية / شبين الكوم",
      "date_of_birth": "15/09/2003"
    },
    "father": {
      "name": "عادل علي سيد أحمد قشطة",
      "religion": "مسلم",
      "nationality": "مصر"
    },
    "mother": {
      "name": "عزة علي شريف محمد",
      "religion": "مسلمة",
      "nationality": "مصر"
    },
    "misc_notes": null
  },
  "uncertain_fields": [],
  "review_required": false,
  "review_notes": []
}
