{
  "document_id": "BC_027",
  "source_files": [
    "data/raw_images/DataSet/Birth Certificate/BC_027.jpeg"
  ],
  "page_count": 1,
  "birth_certificate": {
    "document_title_ar": "صورة قيد الميلاد",
    "serial_number": "3856601225",
    "registration_number": "672",
    "registration_date": "2010/12/11",
    "issue_date": "2025/07/07",
    "health_office": "البتانون",
    "civil_registry": "مركز شبين الكوم",
    "issuing_authority": "وزارة الداخلية / قطاع الأحوال المدنية",
    "governorate_or_administration": "المنوفية",
    "form_reference": null,
    "issuance_system_version": null,
    "barcode_or_machine_notes": null
  },
  "ids": {
    "child_national_id": "31012041700749",
    "father_national_id": null,
    "mother_national_id": null,
    "other_ids": []
  },
  "personal_and_other": {
    "child": {
      "name": "جنة",
      "gender": "أنثى",
      "religion": "مسلمة",
      "nationality": "مصر",
      "place_of_birth": "المنوفية / مركز شبين الكوم",
      "date_of_birth": "04/12/2010"
    },
    "father": {
      "name": "سامح محمد مصطفى عيسى",
      "religion": "مسلم",
      "nationality": "مصر"
    },
    "mother": {
      "name": "رشا محمد عمارة",
      "religion": "مسلمة",
      "nationality": "مصر"
    },
    "misc_notes": null
  },
  "uncertain_fields": [],
  "review_required": false,
  "review_notes": []
}
