{
  "document_id": "BC_036",
  "source_files": [
    "data/raw_images/DataSet/Birth Certificate/BC_036.jpeg"
  ],
  "page_count": 1,
  "birth_certificate": {
    "document_title_ar": "صورة قيد الميلاد",
    "serial_number": "638065568",
    "registration_number": "674",
    "registration_date": null,
    "issue_date": "2015/09/28",
    "health_office": "البتانون",
    "civil_registry": "شبين الكوم",
    "issuing_authority": "وزارة الداخلية / قطاع الأحوال المدنية",
    "governorate_or_administration": "المنوفية",
    "form_reference": null,
    "issuance_system_version": null,
    "barcode_or_machine_notes": null
  },
  "ids": {
    "child_national_id": null,
    "father_national_id": null,
    "mother_national_id": null,
    "other_ids": []
  },
  "personal_and_other": {
    "child": {
      "name": "محمد",
      "gender": "ذكر",
      "religion": "مسلم",
      "nationality": "مصر",
      "place_of_birth": "المنوفية / مركز شبين الكوم",
      "date_of_birth": "23/10/2004"
    },
    "father": {
      "name": "علاء بسيوني السقا",
      "religion": "مسلم",
      "nationality": "مصر"
    },
    "mother": {
      "name": "سماح محمد السقا",
      "religion": "مسلمة",
      "nationality": "مصر"
    },
    "misc_notes": null
  },
  "uncertain_fields": [
    "ids.child_national_id"
  ],
  "review_required": false,
  "review_notes": [
    "patterned/low-contrast scan; child national id gender digit not legible"
  ]
}
