{
  "document_id": "BC_013",
  "source_files": [
    "data/raw_images/DataSet/Birth Certificate/BC_013.jpeg"
  ],
  "page_count": 1,
  "birth_certificate": {
    "document_title_ar": "صورة قيد الميلاد",
    "serial_number": "0261869194",
    "registration_number": "543",
    "registration_date": "2001/08/28",
    "issue_date": "2007/06/24",
    "health_office": "البتانون",
    "civil_registry": "مركز شبين الكوم",
    "issuing_authority": "وزارة الداخلية / قطاع الأحوال المدنية",
    "governorate_or_administration": "المنوفية",
    "form_reference": null,
    "issuance_system_version": null,
    "barcode_or_machine_notes": null
  },
  "ids": {
    "child_national_id": "30108251701822",
    "father_national_id": null,
    "mother_national_id": null,
    "other_ids": []
  },
  "personal_and_other": {
    "child": {
      "name": "هبة",
      "gender": "أنثى",
      "religion": "مسلمة",
      "nationality": "مصر",
      "place_of_birth": "المنوفية / مركز شبين الكوم",
      "date_of_birth": "25/08/2001"
    },
    "father": {
      "name": "عادل علي قشطة",
      "religion": "مسلم",
      "nationality": "مصر"
    },
    "mother": {
      "name": "عزة علي شريف",
      "religion": "مسلمة",
      "nationality": "مصر"
    },
    "misc_notes": null
  },
  "uncertain_fields": [],
  "review_required": false,
  "review_notes": []
}
