{
  "document_id": "BC_040",
  "source_files": [
    "data/raw_images/DataSet/Birth Certificate/BC_040.jpeg"
  ],
  "page_count": 1,
  "birth_certificate": {
    "document_title_ar": "صورة قيد الميلاد",
    "serial_number": "638065856",
    "registration_number": "118",
    "registration_date": "2008/06/10",
    "issue_date": "2008/08/26",
    "health_office": "البتانون",
    "civil_registry": "مركز شبين الكوم",
    "issuing_authority": "وزارة الداخلية / قطاع الأحوال المدنية",
    "governorate_or_administration": "المنوفية",
    "form_reference": null,
    "issuance_system_version": null,
    "barcode_or_machine_notes": null
  },
  "ids": {
    "child_national_id": "30806061701418",
    "father_national_id": null,
    "mother_national_id": null,
    "other_ids": []
  },
  "personal_and_other": {
    "child": {
      "name": "محمود",
      "gender": "ذكر",
      "religion": "مسلم",
      "nationality": "مصر",
      "place_of_birth": "المنوفية / مركز شبين الكوم",
      "date_of_birth": "06/06/2008"
    },
    "father": {
      "name": "علاء بسيوني عبد المقصود السقا",
      "religion": "مسلم",
      "nationality": "مصر"
    },
    "mother": {
      "name": "سماح محمد السقا",
      "religion": "مسلمة",
      "nationality": "مصر"
    },
    "misc_notes": null
  },
  "uncertain_fields": [],
  "review_required": false,
  "review_notes": []
}
