{
  "document_id": "BC_015",
  "source_files": [
    "data/raw_images/DataSet/Birth Certificate/BC_015.jpeg"
  ],
  "page_count": 1,
  "birth_certificate": {
    "document_title_ar": "صورة قيد الميلاد",
    "serial_number": "0139200128",
    "registration_number": "742",
    "registration_date": "1998/11/18",
    "issue_date": "2005/02/15",
    "health_office": "البتانون",
    "civil_registry": "مركز شبين الكوم",
    "issuing_authority": "وزارة الداخلية / قطاع الأحوال المدنية",
    "governorate_or_administration": "المنوفية",
    "form_reference": null,
    "issuance_system_version": null,
    "barcode_or_machine_notes": null
  },
  "ids": {
    "child_national_id": null,
    "father_national_id": null,
    "mother_national_id": null,
    "other_ids": []
  },
  "personal_and_other": {
    "child": {
      "name": "محمد",
      "gender": "ذكر",
      "religion": "مسلم",
      "nationality": "مصر",
      "place_of_birth": "المنوفية / مركز شبين الكوم",
      "date_of_birth": "19/11/1998"
    },
    "father": {
      "name": "عادل علي قشطة",
      "religion": "مسلم",
      "nationality": "مصر"
    },
    "mother": {
      "name": "عزة علي شريف",
      "religion": "مسلمة",
      "nationality": "مصر"
    },
    "misc_notes": null
  },
  "uncertain_fields": [
    "ids.child_national_id",
    "personal_and_other.child.name"
  ],
  "review_required": false,
  "review_notes": []
}
