{
  "document_id": "BC_002",
  "source_files": [
    "data/raw_images/DataSet/Birth Certificate/BC_002.jpeg"
  ],
  "page_count": 1,
  "birth_certificate": {
    "document_title_ar": "صورة قيد الميلاد",
    "serial_number": "3818782828",
    "registration_number": "63",
    "registration_date": "2016/02/13",
    "issue_date": "2025/05/18",
    "health_office": "البتانون",
    "civil_registry": "مركز شبين الكوم",
    "issuing_authority": "وزارة الداخلية / قطاع الأحوال المدنية",
    "governorate_or_administration": "المنوفية",
    "form_reference": "نموذج 2/40",
    "issuance_system_version": null,
    "barcode_or_machine_notes": null
  },
  "ids": {
    "child_national_id": "31602081701669",
    "father_national_id": "26911221400993",
    "mother_national_id": "28104201700421",
    "other_ids": []
  },
  "personal_and_other": {
    "child": {
      "name": "مريم",
      "gender": "أنثى",
      "religion": "مسلمة",
      "nationality": "مصر",
      "place_of_birth": "المنوفية / مركز شبين الكوم",
      "date_of_birth": "08/02/2016"
    },
    "father": {
      "name": "ابراهيم عبد الغني حسن بدر",
      "religion": "مسلم",
      "nationality": "مصر"
    },
    "mother": {
      "name": "غادة حسيني علي الضري",
      "religion": "مسلمة",
      "nationality": "مصر"
    },
    "misc_notes": null
  },
  "uncertain_fields": [],
  "review_required": false,
  "review_notes": []
}
