{
  "document_id": "BC_006",
  "source_files": [
    "data/raw_images/DataSet/Birth Certificate/BC_006.jpeg"
  ],
  "page_count": 1,
  "birth_certificate": {
    "document_title_ar": "صورة قيد الميلاد",
    "serial_number": "0534683685",
    "registration_number": "151",
    "registration_date": "2002/04/12",
    "issue_date": "2008/03/12",
    "health_office": "البتانون",
    "civil_registry": "مركز شبين الكوم",
    "issuing_authority": "وزارة الداخلية / قطاع الأحوال المدنية",
    "governorate_or_administration": "المنوفية",
    "form_reference": null,
    "issuance_system_version": null,
    "barcode_or_machine_notes": null
  },
  "ids": {
    "child_national_id": null,
    "father_national_id": null,
    "mother_national_id": null,
    "other_ids": []
  },
  "personal_and_other": {
    "child": {
      "name": "يارا",
      "gender": "أنثى",
      "religion": "مسلمة",
      "nationality": "مصر",
      "place_of_birth": "المنوفية / مركز شبين الكوم",
      "date_of_birth": "09/04/2002"
    },
    "father": {
      "name": "ابراهيم عبد الغني بدر",
      "religion": "مسلم",
      "nationality": "مصر"
    },
    "mother": {
      "name": "غادة حسني الحضري",
      "religion": "مسلمة",
      "nationality": "مصر"
    },
    "misc_notes": null
  },
  "uncertain_fields": [
    "ids.child_national_id"
  ],
  "review_required": false,
  "review_notes": []
}
